uid,body,title,url,newspaper_uid,host,n_tokens_body,n_tokens_title
50e34cf688e694e1f7e27455ed63c9b4," La pandemia del Covid-19 genera una devastación económica en el país, ante la cual el Congreso y, en particular, el Senado, tiene la disposición de revisar un ingreso mínimo para cada ciudadano, y el problema que se tiene que resolver es determinar la fuente de recursos que absorban ese apoyo, dice el coordinador de Morena en la Cámara Alta, Ricardo Monreal Ávila. Manifiesta el advenimiento de un nuevo orden internacional, que motive debates, a los que México está abierto, en los parlamentos del mundo, uno de los cuales sería la política progresiva fiscal, con la mira de que ""unifiquemos criterios y podamos impulsar medidas similares en razón de la devastación económica que va a generar el coronavirus en el mundo"". Con la cercanía del inicio del tercer año legislativo, del proceso electoral 2020-2021, y en medio de la emergencia sanitaria, Monreal Ávila, en entrevista en su oficina de la Junta de Coordinación Política (Jucopo) del Senado, rechaza que fuerzas morenistas externas a la Cámara Alta afecten a la fracción parlamentaria. Explica que abona a ello que él no entra en disputas por ""pedazos de poder"". Dice que el Senado mismo está blindado de las tormentas políticas, y ello lo posibilita su ""acuerdo de caballeros"", con el Bloque de Contención --formado por la oposición del PAN PRI, MC y PRD--, que se basa en el cumplimiento de la palabra. Con los coordinadores parlamentarios, ""nosotros nos ponemos de acuerdo, e intentamos respetar cada posición y no introducirnos a la vorágine de la política partidista, ni a la vorágine de la actitud facciosa"". También lee: Se reúne AMLO con presidentas del Senado y San Lázaro Monreal Ávila tiene formación política y parlamentaria adquiridas en una trayectoria de más de cuatro décadas, en que ha recibido apoyo de personajes como José Luis Lamadrid Souza, Luis Donaldo Colosio Murrieta, José Trinidad Lanz Cárdenas y Genaro Borrego Estrada, entre otros.  ¿Cómo siente el tiempo político inmediato? – Es un momento complicado. El Congreso se va a centrar en medidas de emergencia económica y legislativas que restauren la confianza ciudadana. Hay más de cien temas en la agenda legislativa; sólo en materia de justicia, 41 proyectos, así como la Ley del Sistema de Ahorro para el Retiro y la reforma de Cannabis, por concluir. El trabajo legislativo va a sufrir profundas modificaciones a consecuencia de la pandemia. Una de ellas es el Congreso Digital. Estamos en ese proceso para que en el próximo periodo de sesiones lo podamos hacer realidad.  ¿Hasta dónde desarrollar legislación económica? – Estamos en disposición de revisar la legislación para atenuar el impacto que va a tener el coronavirus en la economía nacional. Un grupo plural de senadores, con los titulares de Hacienda y Economía, buscan alternativas de ingreso básico para los ciudadanos mexicanos.  No basta diseñar un apoyo, con el que todos estamos de acuerdo, el problema es de dónde se va a obtener ese recurso. Por ello, es clave la política progresiva fiscal, tema que en el mundo vamos a debatir. Ya hay iniciativas de otros parlamentos para que unifiquemos criterios y podamos impulsar medidas similares en razón de la devastación económica que va a generar el coronavirus en el mundo. También lee: Batres rechaza a Ramírez Aguilar para encabezar Mesa Directiva del Senado No van a variar mucho las medidas que se tomen en los próximos años, hoy más que nunca habrá un nuevo orden mundial, y habrá esquemas similares en los parlamentos del mundo, no pueden variar, y México está abierto, tenemos que prepararnos a ese tipo de advenimientos y de presencia urgente en materia legislativa y de actualización normativa mundial.  ¿La bancada de Morena refleja la situación del partido? ¿Tiene fraccionamientos? – Hay respeto entre todos, no hay pensamiento único. Este domingo 30 vamos a decidir la mesa directiva en urnas transparentes, ante dos notarios  públicos. No tenemos ningún problema interno, no lo vamos a tener.  ¿En este primer tercio como mayoría, Morena se desarrolló, se desgastó? – Adentro tenemos opiniones sobre una ley o reforma, pero nos une el pensamiento, acción, ideario político y las acciones públicas del Presidente de la República.  ¿Los polarizan personajes de la corriente de Morena que están en el candelero público? – No. Porque nosotros no nos metemos en la disputa de posiciones, puestos, pedazos de poder; estamos ajenos a eso. A mí en lo personal no me interesa en lo más mínimo estarle disputando espacios a nadie.  ¿El Bloque de Contención es un pacto de caballeros? – Pacto de caballeros. La palabra en la política se ha perdido y nosotros la hemos recobrado en el Senado. Lo que acordamos se respeta.  También lee: Critican a PT por adhesión de legisladores Veo al PAN, con Mauricio Kuri, un hombre honesto, rudo, firme en sus convicciones, con el que podemos dialogar con respeto. Veo a Miguel Ángel Osorio, del PRI, con una experiencia tras de sí impresionante, un político con una trayectoria indiscutible y con una sagacidad política importante. Dante Delgado, de MC, constructor de instituciones, quizás para mí el de mayor experiencia, mayor sabiduría política, actúa con sensatez y con oportunidad. Y Miguel Ángel Mancera, del PRD, quien es un buen jurista y una gente que se ha formado políticamente, con mucho sentido jurídico.  ¿El Bloque de Contención blinda al Senado de tormentas políticas? – Hasta ahora lo ha blindado, porque pareciera que no pasan por aquí, porque nos ponemos de acuerdo, e intentamos respetar cada posición y no introducirnos a la vorágine de la política partidista, ni a la vorágine de la actitud facciosa. Tratamos de mantener al Senado en un proceso de trabajo plural, coordinado, productivo para la nación.  La austeridad de dos años debilita al Senado ante los retos que vienen? – Nosotros nos desprendimos de mil 200 millones de pesos, 25 % del presupuesto, y no se afectó al trabajo legislativo. Se redujo la vida a que estaba acostumbrado el Senado. Ahora es un mundo austero, muy productivo en materia legislativa con menos recursos.  ¿Vemos un Congreso, como elemento del Estado, robusto o la falta de recursos lo debilita? – No. Cada vez más los legisladores se sacuden de la vieja ortodoxia de la dependencia del Ejecutivo. Cada día que pasa, se asumen como un ente equilibrador de los demás poderes; cobra autonomía el Congreso de la Unión. Somos un control real de los poderes. ",Senado esta blindado de tormentas politicas monreal,http://www.eluniversal.com.mx/nacion/senado-esta-blindado-de-tormentas-politicas-monreal,eluniversal,www.eluniversal.com.mx,528,5
0e9852fc236fdf54c3781349373dd039," A pesar del paso irregular de los Tigres y –sobre todo– en una pandemia, Carlos Salcedo se fue a disfrutar del fin de semana en Cancún, con familias y amigos.  El zaguero felino, sacado de la pena, publicó diversas fotografías y videos en sus redes sociales durante sus días de descanso, que incluyó una paseada en yates y cenas en restaurantes.  Lee también: Situación de Tigres tiene al 'Tuca' ""decaído anímicamente"" El cuadro regiomontano suma cuatro partidos sin ganar, incluso, ha perdido unidades en los últimos minutos de esos encuentros. En lo que va del certamen, Salcedo ha jugado cuatro compromisos, 260 minutos, y ha recibido una tarjeta roja.  Los felinos han sido de los equipos más mermados por el Covid-19, con cinco casos desde el arranque del torneo. De los casos más recientes, Nahuel Guzmán y Jorge Torres Nilo han sido de las figuras contagiadas en las últimas semanas. Sin respetar las medidas sanitarias impuestas por la Liga MX, Salcedo salió de Monterrey a disfrutar del fin de semana. Los Tigres reciben el sábado a las Chivas, en el estadio Universitario.  ",Carlos salcedo de vacaciones y fiesta en cancun,https://www.eluniversal.com.mx/universal-deportes/futbol/carlos-salcedo-de-vacaciones-y-fiesta-en-cancun,eluniversal,www.eluniversal.com.mx,95,5
353bff051870eb768f6d795097e65246," Es sábado por la noche. Hay poca gente en los pasillos y andadores de la Unidad Habitacional Tlatelolco, no así cucarachas. En la jardinera de la unidad, en la esquina de las calles Lerdo y Flores Magon, un video tomado por EL UNIVERSAL muestra hasta cuatro cucarachas, de buen tamaño, caminando como cualquier otro día. La jardinera se encuentra frente a una escuela, y a unos veinte metros se observa un letrero que dice “Control de fauna”. Dentro de la jardinera hay un cubo lleno de basura.  Es común ver en la zona, límite entre Tlatelolco y la colonia Guerrero, una o dos cucarachas caminando libremente no es cotidiano ver cuatro juntas, como en esta ocasión. Tampoco es un tema nuevo. Hay reportes en redes sociales de presencia de cucarachas desde al menos 2010.  rmlgv ",Plaga de cucarachas captan cuatro en jardinera de tlatelolco,https://www.eluniversal.com.mx/metropoli/plaga-de-cucarachas-captan-cuatro-en-jardinera-de-tlatelolco,eluniversal,www.eluniversal.com.mx,71,6
7aeddfbe8617c249ef3dff389cc87f06," Dado el incremento de ilícitos con ayuda de artefactos aéreos no tripulados, conocidos como “drones”, en las alcaldías de Álvaro Obregón, Coyoacán y Benito Juárez, la diputada local de Morena, Isabela Rosales Herrera, presentó dos iniciativas para modificar y adicionar diversos códigos y leyes de esta Ciudad.   La morenista considera la necesidad de darle a la autoridad herramientas para sancionar a quien utilice estos aparatos con fines ilegales, por lo que propone una pena de 25 a 50 días de multa o arresto de tres meses a un año, independientemente de los castigos ya contemplados por el Código Penal capitalino, en la comisión de otros ilícitos.   Advirtió que los drones son un avance tecnológico, que lamentablemente han sido utilizados para facilitar ciertas actividades del crimen organizado, como: robo a casa habitación, secuestro y narcomenudeo, entre otros, lo que ha permitido a delincuentes evadir la ley al permitirles actuar a distancia.   Rosales Herrera dio a conocer que actualmente el registro de “drones”, solo se realiza a partir de un peso igual o mayor a dos kilogramos, pero fuera a todos los que tengan un peso menor.    Sin embargo, puso énfasis en que los avances tecnológicos, han permitido una mayor sofisticación en este tipo de aparatos y un menor gramaje, por lo que se necesita un registro donde todo tipo de dron sea registrado, además de contar con los datos personales de sus propietarios.   Por ello, propuso hacer modificaciones al Código Civil, para establecer que el uso de vehículos aéreos no tripulados, se deberá realizar con estricto apego a la ley, para evitar un empleo inadecuado del mismo en contra de cualquier persona, respetando la seguridad de la ciudadanía.   De igual forma,  propone que el Código Penal capitalino contemple los castigos a delitos realizados con ayuda de drones, e imponer una pena que irá de 25 a 50 días de multa o arresto de tres meses a un año.   En lo relacionado a la Ley de Cultura Cívica, propone infraccionar a quien piloteé drones sin contar con el registro correspondiente, mientras que en la Ley de Movilidad busca añadir el reconocimiento de lo que es el vehículo aéreo no tripulado.   Es decir, la iniciativa busca reformas al Código Civil y al Código Penal, por lo fue turnada para su estudio a la Comisión de Administración y Procuración de Justicia.   Mientras que el proyecto para hacer adiciones a la Ley de Movilidad y la Ley de Cultura Cívica, se turnó a las Comisiones Unidas de Movilidad Sustentable y la de Administración y Procuración de Justicia.     lr ",Morena busca cárcel para quien use drones para cometer delitos,https://www.eluniversal.com.mx/metropoli/morena-busca-carcel-para-quien-use-drones-para-cometer-delitos,eluniversal,www.eluniversal.com.mx,218,7
b204f5fa8f5697e92497196ea9660e2c," Hubo un tiempo, durante la Guerra Fría, en que las derechas mexicanas usaban con liberalidad la expresión “el oro de Moscú” para explicar (e implicar) la razón de ser del Partido Comunista Mexicano y otras pequeñas organizaciones de izquierda. El financiamiento del comunismo soviético era lo que, desde la derecha, descifraba la persistencia de “ideas exóticas”, ajenas a un México que había llevado a cabo “la primera revolución social del siglo XX”. Ahora, en la era de la globalización y lejos de la Guerra Fría, efectivamente hay oro externo para los partidos mexicanos, puede llegar de cualquier parte y no por razones ideológicas sino de negocios. Puede provenir, por ejemplo, de Brasil, y aterrizar en las arcas del PRI, como ocurrió en 2012, vía una empresa transnacional con sede en Sao Paulo -Odebrecht S.A.- y que apoyó a Enrique Peña Nieto no por razones ideológicas sino para que le permitiera luego extraer del sector público mucho más oro del que invirtió en los cohechos iniciales. En México y en muchos otros países, los partidos políticos han buscado recursos y otros apoyos dentro y fuera de las fronteras nacionales. A inicios del siglo XIX las logias masónicas fueron proto partidos que sirvieron para organizar a la naciente clase política mexicana, reflejaron visiones encontradas respecto del proyecto para la nueva nación y buscaron respaldo interno y externo: la logia yorquina giró en torno al enviado norteamericano, Joel R. Poinsett, y las corrientes conservadoras, agrupadas en la logia escocesa, buscaron el apoyo de los empresarios españoles que se quedaron en México. Pronto, liberales y conservadores desecharon el novedoso camino electoral como medio para alcanzar y conservar el poder y optaron por el de los pronunciamientos y finalmente por el de la acción directa. Ambos recurrieron a apoyos tanto dentro como fuera del país -en Estados Unidos unos y en Europa otros. Cuando los liberales se impusieron, las elecciones siguieron sin tener importancia, de ahí la dictadura de Porfirio Díaz. Al caer Díaz en 1911 el derecho a gobernar lo volvieron a decidir las armas. Ya entrado el siglo XX y relativamente pacificado el país, las elecciones sin contenido se hicieron rutina. Para administrarlas se dio forma a un partido de Estado que finalmente devino en el PRI y al que nunca le faltaron recursos que directa o indirectamente provinieron de las arcas públicas, de sus organizaciones sindicales y de grupos de interés privados que buscaban favores del gobierno. Al concluir el siglo pasado, la evolución social y cultural del país aunada a los cambios en el sistema de poder internacional forzaron al autoritarismo mexicano a evolucionar y poco a poco el campo electoral adquirió vida real. El marco legal supuso que el flujo principal de los recursos para la competencia electoral dentro y entre los partidos deberían ser públicos, pero rigurosamente vigilados. Sin embargo, ese marco fue sistemáticamente violado y si bien las elecciones de las tres últimas décadas ya han sido efectivamente competidas, sus resultados han sido desvirtuados por fraudes y carretadas de dinero ilegal. Hoy están exponiéndose y debatiéndose ferozmente en los medios y en tribunales dos casos contrastantes de dineros entregados a partidos: los millones de dólares dados por Odebrecht para la campaña presidencial priista de 2012 según la denuncia presentada ante la Fiscalía General de la República por Emilio Lozoya Austin ex director de PEMEX, y un video de 2015 donde Pío López Obrador, el hermano del presidente, recibe un paquete con dinero para contribuir a apoyar las actividades de un recién formado partido de oposición, MORENA, que sería el principal rival -y verdugo- del PRI. El que los montos en ambos casos no sean ni remotamente comparables, no quiere decir que no urja investigar a fondo, con rigor, a ambos. Para el presidente Andrés Manuel López Obrador, empeñado en una lucha intensa, a fondo, contra el enorme abanico de la corrupción pública mexicana, es imprescindible que se esclarezca el caso que involucra no sólo a su partido sino a su hermano. Sólo así se logrará transformar lo que hoy es un golpe duro al proyecto presidencial, pues se le presenta como un triunfo del pasado –“la corrupción somos todos”- sobre el futuro, en un ejemplo del esfuerzo por acabar con un mal que históricamente ha carcomido a la vida pública mexicana. [email protected] ",El oro y los partidos,http://www.eluniversal.com.mx/opinion/lorenzo-meyer/el-oro-y-los-partidos,eluniversal,www.eluniversal.com.mx,378,2
abe9dd396506b6599aeb79c48c7b072e,"  Existen distintos tipos de democracias o modelos que convergen en un tronco común: la toma de decisiones sobre la vida de la colectividad. Durante muchos años la clase política en México ha tomado decisiones de gran envergadura sin consultar a los ciudadanos, es decir, nuestros representantes han decidido por nosotros en asuntos que no necesariamente nos benefician, sino lo contrario, nos comprometen por muchos años, como la emisión de deuda pública o privilegiar gastos faraónicos para ellos mismos.  Los distintos modelos de democracia privilegian algunos aspectos más que otros.  Por ejemplo, unos están a favor de que los ciudadanos participen más (democracia participativa), y otros, de que lo hagan por medio de sus representantes (democracia representativa).  El modelo representativo en el que, se alegaba, los representantes del pueblo sólo veían por sus grupos políticos, es decir, sus partidos, dio pauta a que la ciudadanía se involucrara en asuntos públicos. El 1 de julio de 2018 salimos a las urnas a votar —la mayoría para elegir un cambio— y reflejó, digámoslo así, un tsunami de hartazgo a ese modelo que referí en el primer párrafo, llegando a sumar más de 30 millones de votos a favor de un candidato.  Ante la crisis de representación llegamos a la arena de la participación en la que comenzó la época, justamente, de la nueva democracia participativa.  Gradualmente los ciudadanos hemos encontrado canales para hacernos visibles en la vida pública.  Me refiero a la democracia participativa y a su vinculación con el republicanismo.  El republicanismo contemporáneo puede dividirse en dos grandes grupos:  “En ambos modelos se subraya la importancia primordial de la deliberación como principio que ha de regir el proceso político decisorio, pero, mientras el primer grupo continúa defendiendo el principio de la representación política y las estructuras representativas por considerarlas normativamente deseables, el segundo grupo apela al ideal de la democracia clásica (el gobierno del pueblo y por el pueblo en su sentido literal) para postular que, al menos en términos ideales, las decisiones políticas debieran ser adoptadas por todos los ciudadanos y no sólo por sus representantes electos.” (Marco Vinicio Agulló Pastor, Republicanismo y democracia liberal. Una crítica del pensamiento político republicano, Madrid, España, Centro de Estudios Políticos y Constitucionales, 2016, p.25).  De lo anterior, puedo advertir que el gobierno de Andrés Manuel López Obrador va por el segundo modelo, el ideal de la Grecia antigua y, más enfático, a que las decisiones políticas debieran ser adoptadas por la mayoría de los ciudadanos.  Ahora bien, el Presidente ha planteado un ejercicio participativo con la consulta para iniciar juicio a los expresidentes Carlos Salinas de Gortari, Ernesto Zedillo Ponce de León, Vicente Fox Quesada, Felipe Calderón Hinojosa y Enrique Peña Nieto; incluso una encuesta de esta casa editorial (EL UNIVERSAL) da cuenta que la mayoría de la población quiere llevar ante la justicia a los exmandatarios.  Este planteamiento tiene que analizarse desde diversos aspectos, uno de ellos la democracia participativa. Habrá un tema jurídico debatible pero el Presidente está tomando en cuenta a la ciudadanía que saldrá sin duda a las urnas a ratificar su hartazgo contra el virus de la corrupción, que valga la pena señalar que en el sexenio pasado fue epidémico y sistemático, pues tan solo basta repasar el penoso caso de Emilio Lozoya Austin quien ahogó a Petróleos Mexicanos en las aguas profundas de la corrupción y comprometió su rentabilidad financiera. Por ello, el ejercicio ciudadano que ha convocado el presidente Andrés Manuel López Obrador convierte a los ciudadanos en un jurado, con independencia de que su momento lleguen o no a un juzgador. Para el Presidente lo relevante en este momento es el veredicto ciudadano. Abogado y activista, maestro en Ciencias Penales. @UlrichRichterM    ",Democracia y los expresidentes,http://www.eluniversal.com.mx/opinion/ulrich-richter/democracia-y-los-expresidentes,eluniversal,www.eluniversal.com.mx,321,2
40db49da49aa3888123c6a6cd5dc2317," Mérida.- El Secretariado Ejecutivo del Sistema Nacional de Seguridad (SESNS) registró 4 casos de feminicidios en Yucatán, de los cuales 3 se cometieron en Mérida y uno en Umán, lo que ubica a la capital del Estado en el lugar número 50 de los 100 municipios donde se ha cometido este delito. En las últimas dos semanas, en Mérida y Kanasín se registraron dos casos de mujeres que fueron asesinadas y que son investigadas bajo el protocolo de feminicidio. El primero ocurrió en Residencial Pensiones, donde un joven mató a su novia y luego se suicidó con arma de fuego. El otro caso fue en Villas Oriente, Kanasín, donde las primeras investigaciones de la Fiscalía General de Estado (FGE) revelan que una de las principales líneas de investigación en torno al caso es la autoría de la hijastra de la hoy occisa, como autora intelectual y a un hombre como el autor del asesinato. Lee también: Jessica, Marcela, Danna y Fernanda, 4 feminicidios que sacuden a México Por otro lado, el SESNS señaló que a partir de marzo del año 2020, cuando inició el confinamiento en Yucatán por la pandemia del coronavirus, las llamadas al número de emergencias relacionadas con la violencia hacia la mujer se mantuvo entre 200 y 300, en junio aumentó pero el pasado mes de julio volvió a disminuir. Este organismo federal sostuvo que las llamadas al 911 de enero a julio de 2020, a nivel nacional, alcanzaron 9 millones 602 mil 243, de las cuales 154 mil 610 mil, es decir 1.61 por ciento, estuvieron relacionadas de violencia contra la mujer y de éstas 2 mil 629 se realizaron en Yucatán. Las autoridades estatales comentaron que el reporte de llamadas al 911 presuponen agresiones y maltrato a mujeres como consecuencia de la violencia intrafamiliar y de pareja, lo que actualmente ubica a Yucatán en el lugar 16 entre las 32 entidades federativas. Estas cifras, de acuerdo con el SESNS, indican que cada 2 horas con 9 minutos, el número de emergencias 911 recibe una llamada para reportar un incidente de violencia contra la mujer en Yucatán, lo que equivale a unas 11 llamadas al día. También se destacó la importancia y necesidad de prevenir la violencia intrafamiliar, el feminicidio y las agresiones particularmente hacia las mujeres. Lee también: Diputados proponen homologar delito de feminicidio en los estados afcl ",Mérida ocupa lugar 50 a nivel nacional en feminicidios,https://www.eluniversal.com.mx/estados/merida-ocupa-lugar-50-nivel-nacional-en-feminicidios,eluniversal,www.eluniversal.com.mx,184,6
fe5e33f6130640b6436e910a8917a0e7," Las Águilas del América sufrieron, pero lograron cortar una racha de dos derrotas consecutivas en el Guardianes 2020. Los de Miguel Herrera vinieron de atrás para vencer 1-2 al Atlético de San Luis en el Alfonso Lastras, en una semana que lucía complicada con la lesión de Bruno Valdez. PUEDES LEER: El gesto de Emanuel Aguilera a Bruno Valdez tras anotar gol A continuación te dejamos cinco puntos claves en el triunfo de los azulcrema: 1.- A pesar de que al inicio aceptó un gol a pelota parada, la línea de cinco defensivamente ajustó y no volvió a tener problemas en tiros de esquina o tiros libres indirectos. 2.- Memo Ochoa tuvo una noche casi perfecta, con cuatro atajadas claves para conservar la ventaja. 3.- La media cancha funcionó en los dos sectores: defensivos destacando Fernando “Oso” González y ofensivo con las incursiones de Sebastián Córdova. 4.- Henry Martín encontró la contundencia y llegó a tres goles en el torneo. 5.- Sólo hubo un amonestado por parte de las Águilas, Richard Sánchez, y Miguel Herrera lo sacó para evitar alguna expulsión.    ",Los puntos clave en el triunfo del América ante el Atlético de San Luis,http://www.eluniversal.com.mx/universal-deportes/futbol/puntos-clave-en-el-triunfo-del-america-ante-atletico-de-san-luis,eluniversal,www.eluniversal.com.mx,105,7
