uid,body,title,url,newspaper_uid,host,n_tokens_body,n_tokens_title
c3afd97240c682921cecd5317279914d,"  A dos meses de la salida de quien fuera su titular, la Comisión Nacional de Atención Víctimas (CEAV) sigue sin cabeza y acumulando rezago en su labor de procurar la reparación integral de los perjudicados.  La Ley General de Víctimas entró en vigor hace siete años, pero los afectados por delitos y violaciones a derechos humanos incrementan ante los ojos del Sistema Nacional de Atención a Víctimas (SNAV) y la Comisión Ejecutiva de Atención (CEAV), y se suman con el rezago de años anteriores, lo que ha vuelto la atención más lenta y revictimizante para los perjudicados.  Hay omisiones y una falta de coordinación en las instituciones para cumplir con sus obligaciones, lo que ha conllevado a que la CEAV enfrente 453 juicios de amparo. La falta de respuesta en pronunciarse respecto a las reparaciones integrales por delitos y violaciones de derechos humanos se debe, en parte, a la sobrecarga de trabajo que han presentado las instituciones encargadas de brindar atención a víctimas.  “En México una violación grave a derechos humanos dejó de ser la excepción y empezó a ser la cotidianidad, y cuando las atrocidades son tu normalidad muchas veces no te da la capacidad económica para poder responder a todos los estándares de reparación”, refiere la directiva de Justicia Transicional en México, Daniela Malpica Neri.  También lee: Desaparecieron mil 493 personas de marzo a julio de este año  La ley ordena, el SNAV coordina y la CEAV ejecuta. La comisión ha asumido la atención de las víctimas en la mayoría de los aspectos. “La CEAV por sí sola no puede suplir al sistema nacional ni llevar a cabo sus funciones”, comenta un miembro de la Asamblea Consultiva.  Entre 2015 y 2019 los asuntos atendidos aumentaron, en promedio, 238% anualmente; sin embargo, lo asignado en el Presupuesto de Egresos de la Federación para el Fondo de Ayuda, Asistencia y Reparación Integral no presentó incremento alguno, lo cual obstaculizó la atención para las víctimas, según el Anteproyecto de Presupuesto 2021 de la Junta de Gobierno de la CEAV.  La comisión tiene a su cargo el Registro Nacional de Víctimas (Renavi), que tenía 34 mil 215 personas inscritas y recibe 500 solicitudes al mes, refiere el informe de junio sobre la situación general de la institución.  Algunas víctimas llevan años en espera de entrar en el registro, pero por devolución de documentos o porque falta el reconocimiento de la calidad de víctima ante una autoridad competente se ha negado la inscripción. Un ejemplo es el caso de Morelia, Michoacán, del 15 de septiembre de 2008, que tardó cuatro años en lograr su ingreso en el Renavi.  También lee: Reparten más de 200 millones de pesos a búsqueda de desaparecidos  Miembros de colectivos de familiares de búsqueda de personas desaparecidas denuncian que aunque ya cuentan con la inscripción en el Renavi, presentan retrasos en la entrega de las medidas que les corresponden, tiempo que varía entre meses y años.  La activista mexicana y coordinadora de la Red Eslabones por los Derechos Humanos, Valentina Peralta, plantea que no se han brindado los recursos suficientes para que se establezca una base de datos real sobre víctimas que pueda vincular información.  “Tenemos un Frankenstein de datos de personas víctimas de distintos estados y la Federación, que llegan con todas las anomalías. Lo que tenemos ahora o es una simulación o realmente no han observado con detenimiento la magnitud del compromiso que el estado tiene con las víctimas”.  En una junta de gobierno de la CEAV, el subsecretario de Derechos Humanos, Alejandro Encinas, mencionó: “El Renavi, más que burocratizado, ha tenido una enorme carga nacional”.  También lee: En México hay más de 73 mil personas desaparecidas: Segob  En 2019 se benefició a 6 mil 97 víctimas por la aplicación del Fondo de Ayuda, Asistencia y Reparación Integral. Los delitos y violaciones a derechos humanos más frecuentes en el país son el homicidio, el secuestro, desaparición y desaparición forzada, pero sólo 20% de las víctimas registradas han solicitado acceder a los recursos del fondo de ayuda, asistencia y reparación integral.  Respecto a la reparación integral, hay un rezago en la emisión de más de 3 mil 682 solicitudes, que por ley incluyen en su mayoría compensaciones económicas y que no han sido cubiertas en años anteriores. Ese atraso significa un alza paulatina en la cifra de amparos y se suma a la revictimización por la que pasan los afectados con las instituciones.  Aun con los intentos por dar respuestas a la masividad de víctimas, la comisión no ha resuelto con prontitud las solicitudes.  “El Sistema Nacional de Atención a Víctimas es responsable, una parte de él es la CEAV, que es quien opera los servicios de atención, pero no tiene las condiciones. Es un modelo totalmente aspiracional, pero la circunstancia victimal es una realidad cotidiana y cada minuto se amplía”, dice la activista Peralta.  “ El problema en México es que con 98% de impunidad en los casos no hay quien responda por la violación, por ende, entra de manera subsidiaria el Estado a responder; le ha costado trabajo poder entender esto”, comenta Malpica. Una respuesta pronta y justa para las víctimas, dice, tiene como propósito la reconstrucción del tejido social y crear confianza en las instituciones. ",Comisión de Víctimas sigue rezagada y sin cabeza,http://www.eluniversal.com.mx/nacion/comision-de-victimas-sigue-rezagada-y-sin-cabeza,eluniversal,www.eluniversal.com.mx,421,5
8acfb2f05782c3a77a31ef548f7aebae," Monterrey.- En el marco del Día Internacional de las Víctimas de Desaparición Forzada, la organización Fuerzas Unidas por Nuestros Desaparecidos en Nuevo León (Fundenl) convocó a la realización de una semana de búsqueda, en conjunto con la Comisión Nacional de Búsqueda, Sedena, Guardia Nacional, Fiscalía Especializada en Personas Desaparecidas, Comisión Local de Búsqueda, Fuerza Civil, el Centro de Investigación en Ciencias de Información Geoespacial y el Equipo de Antropología y Arqueología Forense. Dado que en Nuevo León se tiene el registro de cuatro mil 572 personas desaparecidas, en este Día Internacional de las Víctimas de Desaparición Forzada, para Fundenl, la mejor manera de que no se olviden, es salir a buscarlos, señaló la organización civil. Desde hace años, expuso Fundenl, hemos hecho de todo para exigir la búsqueda y localización de todas las personas desaparecidas; hoy sabemos que si no somos nosotras ¿quién?, y si no es ahora ¿cuándo?. “Es por eso, que el día de hoy, hemos convocado a instituciones federales y estatales para realizar –del 30 de agosto al tres de septiembre-, una mega búsqueda de campo en Nuevo León; también, hemos convocado al Centro de Investigación en Ciencias de Información Geoespacial y a nuestro Equipo de Antropología y Arqueología Forense, para que durante una semana salgamos a buscarlos en campo”, destacó Fundenl. Lee también: La persistencia de los familiares de los desaparecidos Asentó la agrupación civil que las instituciones que los acompañarán son la Comisión Nacional de Búsqueda, Comisión Local de Búsqueda, Fiscalía Especializada en Personas Desaparecidas, Instituto de Criminalística y Servicios Periciales, la Comisión Nacional de Derechos Humanos, Secretaría de la Defensa Nacional, Guardia Nacional, Policía Federal y Fuerza Civil de Nuevo León. Precisó Fundenl que esta mega búsqueda, “es el resultado de meses de trabajo, de insistencia, de lucha y marca un precedente en Nuevo León, por lo que esperamos que continuemos y que el compromiso de la Comisión Nacional y de las demás instituciones sea regresar dentro de al menos tres meses la entidad para seguir con estos operativos, ya que esta labor debe ser de manera profesional, coordinada, interinstitucional, y permanente. Por separado, la organización Ciudadanos en Apoyo a los Derechos Humanos (Cadhac), y la agrupación Amores, que aglutina a familiares de desaparecidos, señalaron que en un trabajo conjunto durante 2019 se logró esclarecer el paradero de ocho personas desaparecidas. Asimismo, expusieron que este año el equipo jurídico de Cadhac, en coordinación con las integrantes de Amores, dieron seguimiento a 94 carpetas de investigación abiertas en Nuevo León y Tamaulipas. “Algo se ha avanzado, aunque estamos lejos de erradicar esta horrible violación a derechos humanos, es decir, responder con justicia y verdad a las madres, padres, esposas, esposos, hermanas y familiares que siguen buscando sin descanso” a sus seres queridos. Lee también: Desaparecidos. Una historia que nunca termina en América Latina afcl ",Realizarán mega operativo de búsqueda de desaparecidos en Nuevo León,https://www.eluniversal.com.mx/estados/realizaran-mega-operativo-de-busqueda-de-desaparecidos-en-nuevo-leon,eluniversal,www.eluniversal.com.mx,253,7
f9c09caa15f067373d9937d97b22a830,"    Miahuatlán de Porfirio Díaz.- Vito Irineo Jarquín tiene 83 años. Todos lo conocen como Marcelino, el nombre que le impuso el cura en su bautizo. Marcelino es mezcalero y trabaja en su pequeño palenque ubicado en el pueblo donde nació, La Pila, en Miahuatlán de Porfirio Díaz, un municipio de la Sierra Sur de Oaxaca.  El primer acercamiento de Marcelino al mezcal fue cultivando la tierra. Aprendió a arar cuando tenía menos de 15 años, desde ese momento hasta hoy no ha parado de trabajar. Tuvo cuatro hijos, dos trabajan con él en la producción del mezcal, Silverio y Eleazar, quienes aprendieron de su padre todo lo que necesitan saber.  Hoy, Silverio y Eleazar son la fuerza que mueve el palenque. Eleazar migró de joven a Estados Unidos y apoyó económicamente para consolidar y actualizar el palenque familiar, ahora está de regreso trabajando codo a codo con su papá y su hermano.  Su fuerza es necesaria precisamente ahora, cuando la crisis económica derivada de la pandemia de Covid-19 ha derrumbado las ventas del mezcal y se necesitan de todos los brazos para repuntar el negocio familiar.  Don Marcelino tiene 83 años y lidera un palenque que produce mezcal en La Pila, en Miahuatlán de Porfirio Díaz, un municipio de la Sierra Sur de Oaxaca.    “Tres meses pasamos sin vender ni un litro” cuenta Silverio mientras trabaja cortando maguey en el campo resguardado detrás de su cubrebocas.  Los principales clientes de esta familia de mezcaleros se encuentran en Miahuatlán y las comunidades aledañas, fue por eso que los litros de mezcal dejaron de correr, pues en Oaxaca los pueblos blindaron sus accesos para no permitir la llegada del virus.   También lee: Barbacoa recibe duro golpe por la pandemia  Aunque los cierres carreteros como medida de autoprotección no afectaron la producción de mezcal, sí complicaron que se pudiera mover el producto que nunca se dejó de destilar de la forma ancestral.  “Aquí tenemos todo para trabajar, el agave, el palenque, todo. Los clientes fueron los que se apagaron. Las fiestas patronales, los cumpleaños y demás celebraciones se detuvieron, eso fue lo que más nos afectó, no se vendía nada” cuenta Silverio. Según habitantes de la comunidad, antes de la pandemia la gente llegaba a comprar entre 20 y 50 litros de mezcal, pero ahora, quien se acerca puede pedir desde medio o un litro.  Pese al confinamiento social, la familia Jarquín no detuvo la producción de mezcal, aunque sus ventas bajaron.  A pesar de las bajas ventas, estos tres hombres no han detenido la producción de mezcal, con la esperanza puesta en que pronto mejoren las ventas y que cuando exista una recuperación económica, ellos estén listos para vender.  La esperanza de la familia no es infundada, pues de acuerdo con la Secretaría de Economía de Oaxaca, la industria mezcalera es una de las que más ha crecido en los últimos años, un 173% desde 2015, y la entidad concentra el 90% de la producción anual, que en 2019 se estimó en 7.1 millones de litros. De ellos 4.7 se envasaron para exportación y 80.3% de ese total es mezcal oaxaqueño.  Ahora, pese a la pandemia, el mezcal mantiene un impulso importante que valúa la industria en 5 mil millones de pesos. Además, ha logrado frenar la migración, pues de ella dependen directamente 16 mil personas.  El problema para los Jarquín es que no están afiliados a ninguna agrupación o cámara de mezcaleros, y por ello no han recibido ningún apoyo gubernamental. “Nos han ofrecido que entremos, para recibir apoyos, pero para eso se necesita pagar y como no tenemos suficiente maguey no podemos”, lamentan.   Estos productores no pertenecen a ninguna cámara de mezcaleros, por lo que no recibieron apoyo gubernamental durante la pandemia.    Tradición de más de un siglo   Amanece en La Pila. Marcelino y sus hijos ya están al rededor del horno trabajando. Han esperado varios días para poder encenderlo, pues las constantes lluvias no lo han permitido, las piñas de maguey ya cortadas y listas esperan a un costado del horno.  El horno, un gran hoyo en la tierra, está hecho especialmente para cocer el maguey, y éste en particular lleva más de cien años sirviendo a la familia Jarquín.   También lee: Restaurantes de lujo, los más golpeados por el confinamiento “Mi abuelo hizo el horno, él ya producía mezcal aquí, nada en este horno ha cambiado, aquí jugábamos de niños a darle vueltas” recuerda Silverio. El horno no ha cambiado y la manera en la que estos mezcaleros producen la bebida tampoco. El proceso es completamente tradicional, desde la siembra de los magueyes, su crianza y el corte, basándose en las fases de la luna, respetando el conocimiento tradicional. “Tenemos que cortar el maguey en luna creciente, la sazón del maguey es mejor, también su producción, es el punto. Esa es la tradición que tenemos, le tenemos fe al conocimiento de antes” relata Silverio.   Los principales clientes de esta familia se encuentran en Miahuatlán y comunidades aledañas. Antes vendían hasta 50 litros; hoy, sólo uno.     Mientras el sol comienza a subir, Eleazar y Silverio llenan el horno de leña. Lo hacen de una manera especial que permite que se caliente de manera uniforme. Mientras, Marcelino ajusta una antorcha en una vara larga y puntiaguda. Encendido el horno, el humo se hace presente inundando todo el espacio, la gran humareda se puede mirar desde lejos.  Eleazar coloca las piedras que se calentarán con el fuego y mantendrán el calor para cocer el maguey. Lo hace con destreza, soportando la espesa cortina de humo que impide la visibilidad y mengua la respiración.  El horno permanecerá encendido aproximadamente ocho horas, horas de incertidumbre pues las nubes están presentes y puede comenzar a llover en cualquier momento.  El humo del horno se convierte en una señal, poco a poco vecinos y amigos comienzan a llegar al palenque de los Jarquín para ayudar a cerrar el horno, trabajo que requiere de precisión y velocidad; mientras más personas ayuden es mejor.    El proceso de producción de la bebida es tradicional, pues esperan la luna creciente para cortar el maguey.    Entre los habitantes de La pila es común ayudarse, ya sea en la siembra, el corte de maguey o en el cerrado del horno. “Casi no hay trabajadores y los pocos que hay quieren ganar mucho y no sale, por eso mejor nos ayudamos entre vecinos,” explican.   También lee: Librerías independientes sortean la crisis  También el trueque es una forma de sobrellevar la crisis económica, y en La Pila lo practican con cotidianidad. “Si no hay dinero le dices a alguien, necesito leña, ¿quieres, te doy mezcal por esa leña? Y se ajusta, cambiamos lo que sea, un chivo, gallinas, guajolotes por mezcal”.   El horno de la familia tiene 100 años de antigüedad, fue hecho por el abuelo de Eleazar y Silverio, quien también hacía mezcal.    Para lidiar con la crisis que viven, los familiares más jóvenes de la familia Jarquín han ideado una página de Facebook y han nombrado a su mezcal “Sangre de Maguey”, buscando en las redes sociales una alternativa para la venta de su mezcal artesanal. Y la fuerza para que esta pandemia no los venza.   Para meter las piñas de maguey al horno, los hermanos reciben ayuda de los vecinos, pues no tienen dinero para trabajadores ",“Pasamos meses sin vender ni un litro de mezcal”,http://www.eluniversal.com.mx/estados/pasamos-meses-sin-vender-ni-un-litro-de-mezcal,eluniversal,www.eluniversal.com.mx,602,5
921269b87d6ca663240b4945d62f4bdb," La sierra eléctrica no cesa, el sonido del taladro de concreto perfora mi cabeza cual máquina de dentista amplificada. El martilleo sobre el metal, con otros ruidos estridentes cuyo origen no identifico, cruzan la ventana de manera constante. La obra mayor que los vecinos decidieron hacer durante estas semanas de encierro —precisamente cuando más estamos en casa— pone a prueba la paciencia y la tolerancia de cualquiera.  Desde niños nos enseñan a agradecer, tanto por lo que recibimos, como por lo que hay y tenemos. Los guías espirituales y terapeutas aconsejan: “Por las mañanas agradece tres cosas antes de empezar el día”; o bien: “Antes de acostarte escribe cinco cosas que tengas que agradecer”; también: “Lleva un diario de gratitud”. Sin embargo, este acto no siempre surge de manera natural, fácil o cómoda.  En la vida siempre habrá bendiciones y lo contrario: contextos adversos a los que podemos reconocer como maestros. Es fácil agradecer las primeras cuando las cosas van como deseamos, cuando todo fluye y se da sin dificultades. Sin embargo, cuando aparecen esos maestros, en especial aquellos que por duros, exigentes o desfavorables nos hacen crecer a “golpe de martillo”, agradecer su existencia simplemente no nace. Mientras atravesamos un proceso difícil, sólo cerramos los ojos y apretamos el paso en espera de librar la tormenta. Con el tiempo, volteamos atrás y agradecemos haber tenido aquel maestro que de momento nos hizo sufrir. Es entonces que nos percatamos de que, en realidad, haber vivido esa experiencia nos sacudió pero nos llevó a ser lo que somos y, de alguna manera, nos convirtió en mejores personas.  Puede parecer algo tonto, empero, la experiencia de escuchar sin tregua el ruido de la construcción de mis vecinos, ha puesto a prueba lo que predico: la tolerancia y la paciencia para tener la capacidad de concentrarme en escribir, practicar la meditación, convivir con amabilidad y, al mismo tiempo, permanecer de buen humor… (¿todo el día, en serio?).  También me ha llevado a percatarme del valor de la ausencia de ruido. Benditos ratos en los que escucho el silencio gracias a que las máquinas paran; ese “silencio” urbano que antes no apreciaba ni reconocía y que ahora por contraste se compara con la serenidad en la cima de una montaña sagrada.  Los seres humanos, cretinos como somos, necesitamos trabajar mucho para valorar los días de descanso; pasar hambre para valorar la comida en la mesa; estar días en el hospital para apreciar un instante al aire libre; padecer enfermedades para valorar la salud. Y me pregunto, ¿cuántas otras cosas apreciamos por su ausencia cuando nos percatamos de que las considerábamos una obligación de la vida?  Podemos pensar en nimiedades como son la ausencia de prisa, tráfico, del altero de platos por lavar; o en cuestiones más relevantes como la ausencia de angustia al ver los resultados del análisis de sangre en los rangos correctos; de dolor; de ansiedad al poder sacar de la cartera lo necesario para el gasto; o, también, en la ausencia de tensión con algún familiar. Cuando esos aspectos se producen con espontaneidad, no valoramos lo que significan y cuánto contribuyen a la tranquilidad en nuestra vida. Y bien sabemos que la tranquilidad es lo más parecido a la felicidad.  ¿Qué ausencias en tu vida contribuyen a tu tranquilidad, lo has pensado? Aquellas que —al no estar, no ser, no suceder— hacen que tu día pase como “normal”.  Te propongo agradecer a estos maestros, no sólo por las noches o al amanecer, sino durante el día; es una invitación a tener la conciencia abierta y percibir aquello que por su ausencia nos hace vivir mejor.  ",Agradecer la ausencia,http://www.eluniversal.com.mx/opinion/gaby-vargas/agradecer-la-ausencia,eluniversal,www.eluniversal.com.mx,291,2
